{
  "entry_id": "meta.muse-spark-1.3",
  "provider": "meta",
  "model_match": ["muse-spark-1.3"],
  "verified_at": "2026-10-27",
  "max_age_days": 14,
  "source_urls": [
    "https://dev.meta.ai/docs/prompt-caching",
    "https://dev.meta.ai/docs/cookbook/prompt-caching"
  ],
  "caching": {
    "implicit_default": true,
    "can_disable": false,
    "explicit_supported": false,
    "min_cacheable_tokens": null,
    "write_multiplier": null,
    "read_multiplier": null,
    "usage_fields": {
      "cache_read": "usage.prompt_tokens_details.cached_tokens",
      "total_input": "usage.prompt_tokens"
    },
    "notes": "Meta documents automatic prompt caching. Cache disabling and explicit breakpoints were not verified; prices and minimum token thresholds are intentionally unknown."
  }
}
